Character,Target,,,,,
X,Warrior,Archer,Wizard,Kobold,Troll,Dragon
Warrior,X,X,X,That Kobold shall taste my steal!,I shall vanquish that vile Troll!,A Dragon is the mightiest prize for one of my caliber. 
Archer,X,X,X,A Kobold could be a sporting prey.,I'll show that Troll that brawn won't win everything. ,Let's see if Dragon is actually the most dangerous game.
Wizard,X,X,X,That Kobold must meet his fate.,That Troll is destined for conflict.,That Dragon must meet his end.
Kobold,Me should give that Warrior bully a piece of my mind.,I should teach that tricksy Archer a lesson.,Me should hush that Wizard up.,X,X,X
Troll,That Warrior need big womp WOMP!,That Archer too cocky. I womp him!,"That Wizard have magic, but I have WOMP!",X,X,X
Dragon,That Warrior will roast nicely in his metal armor.,That Archer will be a nice side dish.,That Wizard will have a magically zestful flavor.,X,X,X